{
  "$schema": "https://json-schema.org/draft/2020-12/schema",
  "title": "SentinelGRC Endpoint Posture",
  "type": "object",
  "required": [
    "schema_version",
    "collected_at",
    "asset_id",
    "hostname",
    "bitlocker_system_drive",
    "firewall_all_profiles_enabled",
    "defender_realtime_enabled",
    "days_since_last_update"
  ],
  "additionalProperties": false,
  "properties": {
    "schema_version": {
      "type": "string",
      "const": "1.0"
    },
    "collected_at": {
      "type": "string",
      "format": "date-time",
      "pattern": "^\\d{4}-\\d{2}-\\d{2}T\\d{2}:\\d{2}:\\d{2}(?:\\.\\d+)?(?:Z|[+-]\\d{2}:\\d{2})$"
    },
    "asset_id": {
      "type": "string",
      "minLength": 1,
      "maxLength": 128,
      "pattern": "^[A-Za-z0-9][A-Za-z0-9._:-]{0,127}$"
    },
    "hostname": {
      "type": "string",
      "minLength": 1,
      "maxLength": 255,
      "pattern": "^[^\\s\\u0000-\\u001F\\u007F\\u200B\\uFEFF](?:[^\\u0000-\\u001F\\u007F\\u200B\\uFEFF]*[^\\s\\u0000-\\u001F\\u007F\\u200B\\uFEFF])?$"
    },
    "os": {
      "type": [
        "string",
        "null"
      ],
      "minLength": 1,
      "maxLength": 128,
      "pattern": "^[^\\s\\u0000-\\u001F\\u007F\\u200B\\uFEFF](?:[^\\u0000-\\u001F\\u007F\\u200B\\uFEFF]*[^\\s\\u0000-\\u001F\\u007F\\u200B\\uFEFF])?$"
    },
    "os_version": {
      "type": [
        "string",
        "null"
      ],
      "minLength": 1,
      "maxLength": 128,
      "pattern": "^[^\\s\\u0000-\\u001F\\u007F\\u200B\\uFEFF](?:[^\\u0000-\\u001F\\u007F\\u200B\\uFEFF]*[^\\s\\u0000-\\u001F\\u007F\\u200B\\uFEFF])?$"
    },
    "domain": {
      "type": [
        "boolean",
        "null"
      ]
    },
    "bitlocker_system_drive": {
      "type": "boolean"
    },
    "firewall_all_profiles_enabled": {
      "type": "boolean"
    },
    "defender_realtime_enabled": {
      "type": "boolean"
    },
    "days_since_last_update": {
      "type": [
        "integer",
        "null"
      ],
      "minimum": 0
    },
    "owner": {
      "type": "string",
      "minLength": 1,
      "maxLength": 128,
      "pattern": "^[^\\s\\u0000-\\u001F\\u007F\\u200B\\uFEFF](?:[^\\u0000-\\u001F\\u007F\\u200B\\uFEFF]*[^\\s\\u0000-\\u001F\\u007F\\u200B\\uFEFF])?$"
    },
    "criticality": {
      "type": "string",
      "enum": [
        "low",
        "medium",
        "high",
        "critical"
      ]
    },
    "checks": {
      "type": "array",
      "maxItems": 128,
      "items": {
        "type": "object",
        "required": [
          "name",
          "passed",
          "value",
          "error"
        ],
        "additionalProperties": false,
        "properties": {
          "name": {
            "type": "string",
            "minLength": 1,
            "maxLength": 128,
            "pattern": "^[^\\s\\u0000-\\u001F\\u007F\\u200B\\uFEFF](?:[^\\u0000-\\u001F\\u007F\\u200B\\uFEFF]*[^\\s\\u0000-\\u001F\\u007F\\u200B\\uFEFF])?$"
          },
          "passed": {
            "type": "boolean"
          },
          "value": {},
          "error": {
            "type": [
              "string",
              "null"
            ],
            "minLength": 1,
            "maxLength": 512,
            "pattern": "^[^\\s\\u0000-\\u001F\\u007F\\u200B\\uFEFF](?:[^\\u0000-\\u001F\\u007F\\u200B\\uFEFF]*[^\\s\\u0000-\\u001F\\u007F\\u200B\\uFEFF])?$"
          }
        }
      }
    }
  }
}
